complaint_id,created_at,customer_name,customer_email,category,priority,urgency,sla,status,sentiment_label,sentiment_score,text
CMP-638BC9D4,2026-03-11T00:54:06.976634,barath,bharath@gmail.com,Product,Medium,FALSE,24 Hours,Resolved,Negative,-0.1027,"For the past 5 days, I have experienced frequent service interruptions and slow speeds, significantly affecting my ability to work from home"
CMP-C51B1C43,2026-03-11T00:59:45.983903,Priya Patel,priya.patel99@example.com,Product,High,TRUE,12 Hours,Resolved,Positive,0.8201,"""I wanted to let you know that the customer service representative I spoke to yesterday (John) was very polite, but he wasn't able to answer my questions about the new software update features. It would be helpful if your team was trained better on the new release notes before they go live."""
CMP-A22D9084,2026-03-11T01:02:09.871314,Elena Rodriguez,elena_rod@example.com,Product,Critical,TRUE,2 Hours,Resolved,Negative,-0.8996,"""The new router I purchased from your store yesterday is completely dead. I plugged it in exactly as the instructions said, and it sparked and started smoking! This is incredibly dangerous and it could have started a fire in my apartment. I demand a replacement and a formal apology right now."""
CMP-05E18260,2026-03-11T01:17:06.235894,priyaa,priyaa@gmail.com,Product,High,TRUE,12 Hours,Resolved,Positive,0.8201,"""I wanted to let you know that the customer service representative I spoke to yesterday (John) was very polite, but he wasn't able to answer my questions about the new software update features. It would be helpful if your team was trained better on the new release notes before they go live."""
CMP-380C1118,2026-03-11T01:18:42.050934,elana,elan@gmail.com,Product,Critical,TRUE,2 Hours,Resolved,Negative,-0.8996,"""The new router I purchased from your store yesterday is completely dead. I plugged it in exactly as the instructions said, and it sparked and started smoking! This is incredibly dangerous and it could have started a fire in my apartment. I demand a replacement and a formal apology right now."""
CMP-1EDE7D6F,2026-03-11T19:40:55.925554,saikiran,segarsaikiran11071@gmail.com,Product,Medium,FALSE,24 Hours,Resolved,Neutral,-0.0191,i have issue in my modem which i bought last week it doesn't give reach of network more than 10 meter
CMP-14E7CA78,2026-03-11T20:23:11.961740,Test User,test@example.com,Product,High,TRUE,12 Hours,Resolved,Neutral,0,I really dont know what is happening or where this goes or what system this is even related to. Maybe the color blue?
CMP-90B9F873,2026-03-11T20:29:30.898927,saikiran,segarsaikiran11071@gmail.com,Product,High,TRUE,12 Hours,Resolved,Neutral,0,"""I really dont know what is happening or where this goes or what system this is even related to. Maybe the color blue?"""
